{
  "approvalStatus": "APPROVED_FOR_LIBRARY_IMPORT",
  "packageId": "content-053a2beb217a9ce3233ce42b",
  "packageVersion": 1,
  "packageSha256": "12d3a9796f1d5beafd9fdeb0949c7d9d177fd90c6d214ec80b1d135a056d02f3",
  "approvedAt": "2026-10-05T00:00:00.000Z",
  "approver": "User (explicit request to import the next real article batch from NASA)",
  "decision": "The user explicitly authorized a real NASA import batch for educational and informational use. Each official NASA page was fetched and its full text extracted verbatim, then reviewed individually: NASA page provenance and a readable citation date are required, and any third-party credit, courtesy/licence notice, syndicated or contributed content, or topic-hub shape excludes the item. NASA Images and Media Usage Guidelines are recorded as the source-policy evidence. No NASA image, insignia or identifier is reused: imageReference is null for every item."
}
