{
  "approvalStatus": "APPROVED_FOR_LIBRARY_IMPORT",
  "packageId": "content-73ea9d3b900ec8bfd7795c2c",
  "packageVersion": 1,
  "packageSha256": "29a293f44d133743be0ddd85dfaec2b4646f5edbad23f5d229339f74d08476ec",
  "approvedAt": "2026-10-05T00:00:00.000Z",
  "approver": "User (explicit request to import NOAA Ocean Service articles)",
  "decision": "The user explicitly authorized a real NOAA Ocean Service import batch. Each official oceanservice.noaa.gov page was fetched and its full text extracted verbatim, then reviewed individually for reuse rights and provenance: a NOAA author credit and citation date are required, and any copyright, third-party credit, courtesy/licence or restriction notice excludes the item. The official NOS disclaimer is recorded as source-policy evidence. No images or media are reused: imageReference is null for every item."
}
