{
  "approvalStatus": "APPROVED_FOR_LIBRARY_IMPORT",
  "packageId": "content-fb1534d1d46bcd89f85cb922",
  "packageVersion": 1,
  "packageSha256": "868184490d406720014b757deab9ebfcac077ca3a8490e4d84a69b0ce0ef9e04",
  "approvedAt": "2026-10-04T00:00:00.000Z",
  "approver": "User (explicit request to import 12 audited VOA articles)",
  "decision": "The user explicitly authorized importing 12 VOA Learning English articles that passed extraction verification and rights validation. Each official page and its full article text were inspected; items without a VOA-named producer credit were excluded rather than force-fitted; unverified third-party media was excluded."
}
